{
  "environment": {
    "dtype": "bfloat16",
    "python": "3.12",
    "runtime_backend": "transformers_custom_code",
    "worker_lock": "workers/moss_en/uv.lock",
    "worker_lock_sha256": "ac392045030024e28a7ec9103fce0a73f96021d4880324d8e770a2fd6e17890c"
  },
  "estimated_download_bytes": 4853759602,
  "files": [
    {
      "kind": "tokenizer",
      "path": "added_tokens.json",
      "sha256": "c0284b582e14987fbd3d5a2cb2bd139084371ed9acbae488829a1c900833c680",
      "size_bytes": 707
    },
    {
      "kind": "remote_code",
      "path": "chat_template.jinja",
      "sha256": "a55ee1b1660128b7098723e0abcd92caa0788061051c62d51cbe87d9cf1974d8",
      "size_bytes": 4168
    },
    {
      "kind": "remote_code",
      "path": "chat_template_default.py",
      "sha256": "66c5200b971415a868550d402bc2a729a3ff58f2e333180f6c68f4dba6c725f5",
      "size_bytes": 1676
    },
    {
      "kind": "config",
      "path": "config.json",
      "sha256": "64a1d6dcb3edc04cd358a680785c3872d77d3b85f7448ab9638423b69efce72c",
      "size_bytes": 3529
    },
    {
      "kind": "config",
      "path": "generation_config.json",
      "sha256": "49b7b376c9a77281e37b1544e00f6b83ffe1d46bd47ff1c5ee04a7d642ecbe2b",
      "size_bytes": 69
    },
    {
      "kind": "tokenizer",
      "path": "merges.txt",
      "sha256": "8831e4f1a044471340f7c0a83d7bd71306a5b867e95fd870f74d0c5308a904d5",
      "size_bytes": 1671853
    },
    {
      "kind": "model",
      "path": "model-00000-of-00001.safetensors",
      "sha256": "3c453ea95f64fa957f9edfb095ef07b0da93ee757eac12505a9f241d342fb326",
      "size_bytes": 4837771952
    },
    {
      "kind": "model",
      "path": "model.safetensors.index.json",
      "sha256": "47b5a6d91f49cac3da84a0cc598c75378adefa59196ef4771024702a5cb4c4a0",
      "size_bytes": 78091
    },
    {
      "kind": "remote_code",
      "path": "modeling_Moss.py",
      "sha256": "e247a8e53df66ac48db8dc2896db6f83bbd964f2acb9120507207ee2c1bca8d1",
      "size_bytes": 13352
    },
    {
      "kind": "remote_code",
      "path": "processing_Moss.py",
      "sha256": "d84a1e84666f291ad2f65b2621151836cabc74296eac103d892862daaff8108e",
      "size_bytes": 8701
    },
    {
      "kind": "tokenizer",
      "path": "special_tokens_map.json",
      "sha256": "76862e765266b85aa9459767e33cbaf13970f327a0e88d1c65846c2ddd3a1ecd",
      "size_bytes": 613
    },
    {
      "kind": "tokenizer",
      "path": "tokenizer.json",
      "sha256": "aeb13307a71acd8fe81861d94ad54ab689df773318809eed3cbe794b4492dae4",
      "size_bytes": 11422654
    },
    {
      "kind": "tokenizer",
      "path": "tokenizer_config.json",
      "sha256": "443bfa629eb16387a12edbf92a76f6a6f10b2af3b53d87ba1550adfcf45f7fa0",
      "size_bytes": 5404
    },
    {
      "kind": "tokenizer",
      "path": "vocab.json",
      "sha256": "ca10d7e9fb3ed18575dd1e277a2579c16d108e32f27439684afa0e10b1440910",
      "size_bytes": 2776833
    }
  ],
  "installed_size_bytes": 4853759602,
  "license_id": "Apache-2.0",
  "license_url": "https://huggingface.co/OpenMOSS-Team/MOSS-Transcribe-preview-2B",
  "manifest_version": 1,
  "model_id": "moss_transcribe_preview_2b",
  "repository": "OpenMOSS-Team/MOSS-Transcribe-preview-2B",
  "requires_terms_acceptance": false,
  "revision": "c98175cb20e48bd9be4e95f6c85f2af18899f780",
  "trust_remote_code": true,
  "worker": "moss_en"
}
