{
  "component_sources": [
    {
      "files": [
        {
          "installed_path": "embedding/pytorch_model.bin",
          "source_path": "pytorch_model.bin",
          "source_sha256": "366edf44f4c80889a3eb7a9d7bdf02c4aede3127f7dd15e274dcdb826b143c56",
          "source_size_bytes": 26645418
        }
      ],
      "license_id": "CC-BY-4.0",
      "license_url": "https://huggingface.co/pyannote/wespeaker-voxceleb-resnet34-LM",
      "relationship": "derived",
      "repository": "pyannote/wespeaker-voxceleb-resnet34-LM",
      "requires_terms_acceptance": false,
      "revision": "837717ddb9ff5507820346191109dc79c958d614"
    }
  ],
  "environment": {
    "dtype": "float32",
    "python": "3.12",
    "runtime_backend": "pyannote_audio",
    "worker_lock": "workers/pyannote/uv.lock",
    "worker_lock_sha256": "247aee7cadcee6d0643fa741bc25bee23807b24c0c032fed11b12e7b33d5ba03"
  },
  "estimated_download_bytes": 32821421,
  "files": [
    {
      "kind": "config",
      "path": "config.yaml",
      "sha256": "5ce2bfa9a938dc132cec1172592d65173cbb8f444ea1e4133f10f9391de155be",
      "size_bytes": 444
    },
    {
      "kind": "model",
      "path": "embedding/pytorch_model.bin",
      "sha256": "6f10ff60898a1d185fa22e1d11e0bfa8a92efec811f11bca48cb8cafebefd929",
      "size_bytes": 26646242
    },
    {
      "kind": "model",
      "path": "plda/plda.npz",
      "sha256": "9b77bcd840692710dd3496f62ecfeed8d8e5f002fd991b785079b244eab7d255",
      "size_bytes": 133852
    },
    {
      "kind": "model",
      "path": "plda/xvec_transform.npz",
      "sha256": "325f1ce8e48f7e55e9c8aa47e05d2766b7c48c4b25b8de8dd751e7a4cc5fbe8f",
      "size_bytes": 134376
    },
    {
      "kind": "model",
      "path": "segmentation/pytorch_model.bin",
      "sha256": "7ad24338d844fb95985486eb1a464e32d229f6d7a03c9abe60f978bacf3f816e",
      "size_bytes": 5906507
    }
  ],
  "installed_size_bytes": 32821421,
  "license_id": "CC-BY-4.0",
  "license_url": "https://huggingface.co/pyannote/speaker-diarization-community-1",
  "manifest_version": 1,
  "model_id": "pyannote_community_1",
  "repository": "pyannote/speaker-diarization-community-1",
  "requires_terms_acceptance": true,
  "revision": "3533c8cf8e369892e6b79ff1bf80f7b0286a54ee",
  "trust_remote_code": false,
  "worker": "pyannote"
}
