{
  "environment": {
    "dtype": "bfloat16",
    "python": "3.12",
    "runtime_backend": "qwen_asr_transformers",
    "worker_lock": "workers/qwen/uv.lock",
    "worker_lock_sha256": "ef7d017bad97b5f521a4c137d7fec50bfc8dfdcc454a11a6699a111ba29809ce"
  },
  "estimated_download_bytes": 1880560703,
  "files": [
    {
      "kind": "tokenizer",
      "path": "chat_template.json",
      "sha256": "75a8cfca24f00de72d796fbfed6858fc9614ef3dabd8696684cc3bc03a9c58ff",
      "size_bytes": 1161
    },
    {
      "kind": "config",
      "path": "config.json",
      "sha256": "76d3ae4601ce939830b2517f4a6cadb86cc51316c3900af6b020b051c21a478c",
      "size_bytes": 6193
    },
    {
      "kind": "config",
      "path": "generation_config.json",
      "sha256": "1da527824d81e07118facff437e03f2e24a23311e3bdeb2368973fe77e5f275c",
      "size_bytes": 142
    },
    {
      "kind": "tokenizer",
      "path": "merges.txt",
      "sha256": "8831e4f1a044471340f7c0a83d7bd71306a5b867e95fd870f74d0c5308a904d5",
      "size_bytes": 1671853
    },
    {
      "kind": "model",
      "path": "model.safetensors",
      "sha256": "79d6cbd4c98c7bbffe9db2edac07f56cd6637d0d5944b27f6c2b8353840323ea",
      "size_bytes": 1876091704
    },
    {
      "kind": "config",
      "path": "preprocessor_config.json",
      "sha256": "45e120a4eda2c20c5d7f2ea9354e63536bf35e27aa573fb7cdf78017b378770d",
      "size_bytes": 330
    },
    {
      "kind": "tokenizer",
      "path": "tokenizer_config.json",
      "sha256": "4942d005604266809309cabc9f4e9cb89ce855d59b14681fdc0e1cc62ea26c4c",
      "size_bytes": 12487
    },
    {
      "kind": "tokenizer",
      "path": "vocab.json",
      "sha256": "ca10d7e9fb3ed18575dd1e277a2579c16d108e32f27439684afa0e10b1440910",
      "size_bytes": 2776833
    }
  ],
  "installed_size_bytes": 1880560703,
  "license_id": "Apache-2.0",
  "license_url": "https://huggingface.co/Qwen/Qwen3-ASR-0.6B",
  "manifest_version": 1,
  "model_id": "qwen3_asr_0_6b",
  "repository": "Qwen/Qwen3-ASR-0.6B",
  "requires_terms_acceptance": false,
  "revision": "5eb144179a02acc5e5ba31e748d22b0cf3e303b0",
  "trust_remote_code": false,
  "worker": "qwen"
}
