{
  "environment": {
    "dtype": "bfloat16",
    "python": "3.12",
    "runtime_backend": "fireredasr2s_vllm",
    "worker_lock": "workers/firered/uv.lock",
    "worker_lock_sha256": "14543cb7df6705b7ec82ef75e4a265bf2edf9e7f8b4e9465560ac4114b26f445"
  },
  "estimated_download_bytes": 18870832417,
  "files": [
    {
      "kind": "config",
      "path": "Qwen2-7B-Instruct/config.json",
      "sha256": "8b9a4f6c0acf4854a2d301616d4203039c3d7972cb0a557dae98686b6c3ae4b2",
      "size_bytes": 663
    },
    {
      "kind": "config",
      "path": "Qwen2-7B-Instruct/generation_config.json",
      "sha256": "3a8f9087e486054c8a4a08dae2e5a3ba62e23da212b5b8c08bc42cb983c3459f",
      "size_bytes": 243
    },
    {
      "kind": "tokenizer",
      "path": "Qwen2-7B-Instruct/merges.txt",
      "sha256": "599bab54075088774b1733fde865d5bd747cbcc7a547c5bc12610e874e26f5e3",
      "size_bytes": 1671839
    },
    {
      "kind": "model",
      "path": "Qwen2-7B-Instruct/model-00001-of-00004.safetensors",
      "sha256": "26d9919262ccd063fcdfd926763fe9025ef1e3073767aaa8c83a375d7c5140c4",
      "size_bytes": 3945426872
    },
    {
      "kind": "model",
      "path": "Qwen2-7B-Instruct/model-00002-of-00004.safetensors",
      "sha256": "f5bb99fdadcac55c2c176497ec99f088a1764e78ed986fa4a0d45d12426ef0fa",
      "size_bytes": 3864726352
    },
    {
      "kind": "model",
      "path": "Qwen2-7B-Instruct/model-00003-of-00004.safetensors",
      "sha256": "0b749a4446d7cda007d5e7bd9f908849d08d89867192d4c039dc167e9ab5a02e",
      "size_bytes": 3864726408
    },
    {
      "kind": "model",
      "path": "Qwen2-7B-Instruct/model-00004-of-00004.safetensors",
      "sha256": "da724bb7d3c3512eb371aa6caa5bcc08d78bda84f94e00ae9a9b2124e3e9c62f",
      "size_bytes": 3556392240
    },
    {
      "kind": "model",
      "path": "Qwen2-7B-Instruct/model.safetensors.index.json",
      "sha256": "f00d17cbf433746c391ad43948613e373aa51222dbee3b0db61ffff59a74bb1a",
      "size_bytes": 27752
    },
    {
      "kind": "tokenizer",
      "path": "Qwen2-7B-Instruct/tokenizer.json",
      "sha256": "f7c9b2dba4a296b1aa76c16a34b8225c0c118978400d4bb66bff0902d702f5b8",
      "size_bytes": 7028015
    },
    {
      "kind": "tokenizer",
      "path": "Qwen2-7B-Instruct/tokenizer_config.json",
      "sha256": "be21acaf90e7f449b7282fdef7b06516a0102476e86cbc2108e18ac071f9cc9c",
      "size_bytes": 1288
    },
    {
      "kind": "tokenizer",
      "path": "Qwen2-7B-Instruct/vocab.json",
      "sha256": "ca10d7e9fb3ed18575dd1e277a2579c16d108e32f27439684afa0e10b1440910",
      "size_bytes": 2776833
    },
    {
      "kind": "model",
      "path": "asr_encoder.pth.tar",
      "sha256": "6cfa83b4d692c0ac8b61a767fc4253a6350c11e1edcdf6418d040b41240b900e",
      "size_bytes": 1472
    },
    {
      "kind": "config",
      "path": "cmvn.ark",
      "sha256": "6efba6105429d1630c05d818d956bfe4edfad37a04b3b27bb5a029b9adb37945",
      "size_bytes": 1311
    },
    {
      "kind": "tokenizer",
      "path": "dict.txt",
      "sha256": "1bc613de2112d257e61a349c3e72d1b1a9cf19c33d3ca954197ad2171e5ea07b",
      "size_bytes": 79172
    },
    {
      "kind": "model",
      "path": "model.pth.tar",
      "sha256": "6ebd76ce1799e72c3180cf73eca036fee338630a95c0069361ea91c894544bcd",
      "size_bytes": 3627720250
    },
    {
      "kind": "tokenizer",
      "path": "train_bpe1000.model",
      "sha256": "473bbc157cb4eade2059b30a3c877a1c29bd50cadbfbed869ae36eeade7fee07",
      "size_bytes": 251707
    }
  ],
  "installed_size_bytes": 18870832417,
  "license_id": "Apache-2.0",
  "license_url": "https://huggingface.co/FireRedTeam/FireRedASR2-LLM",
  "manifest_version": 1,
  "model_id": "firered_asr2_llm",
  "repository": "FireRedTeam/FireRedASR2-LLM",
  "requires_terms_acceptance": false,
  "revision": "2c5e0f415b9afb8f67cb8b00ea4c54959f70e824",
  "trust_remote_code": false,
  "worker": "firered"
}
