{
  "environment": {
    "dtype": "bfloat16",
    "python": "3.12",
    "runtime_backend": "qwen_asr_transformers",
    "worker_lock": "workers/qwen/uv.lock",
    "worker_lock_sha256": "ef7d017bad97b5f521a4c137d7fec50bfc8dfdcc454a11a6699a111ba29809ce"
  },
  "estimated_download_bytes": 4703055333,
  "files": [
    {
      "kind": "tokenizer",
      "path": "chat_template.json",
      "sha256": "75a8cfca24f00de72d796fbfed6858fc9614ef3dabd8696684cc3bc03a9c58ff",
      "size_bytes": 1161
    },
    {
      "kind": "config",
      "path": "config.json",
      "sha256": "2e74a751548b8ad7d7526d29365ad8144c345d8b412b1152d25dc6698452712f",
      "size_bytes": 6194
    },
    {
      "kind": "config",
      "path": "generation_config.json",
      "sha256": "1da527824d81e07118facff437e03f2e24a23311e3bdeb2368973fe77e5f275c",
      "size_bytes": 142
    },
    {
      "kind": "tokenizer",
      "path": "merges.txt",
      "sha256": "8831e4f1a044471340f7c0a83d7bd71306a5b867e95fd870f74d0c5308a904d5",
      "size_bytes": 1671853
    },
    {
      "kind": "model",
      "path": "model-00001-of-00002.safetensors",
      "sha256": "a4cd1f1a04d90b757dc7f7dd26254e69a013b19e80efe590a83c6a3bde8608d6",
      "size_bytes": 4220320824
    },
    {
      "kind": "model",
      "path": "model-00002-of-00002.safetensors",
      "sha256": "6e0b9d9e09e2e0238e7ef3cc8a484ab387e91b90f1900bedf88bc92d7929ccfc",
      "size_bytes": 478200688
    },
    {
      "kind": "model",
      "path": "model.safetensors.index.json",
      "sha256": "f994739fe38e5210b9e3e8ce6c6307315e2ceac3cb630e7b7414d69dce520f60",
      "size_bytes": 64821
    },
    {
      "kind": "config",
      "path": "preprocessor_config.json",
      "sha256": "45e120a4eda2c20c5d7f2ea9354e63536bf35e27aa573fb7cdf78017b378770d",
      "size_bytes": 330
    },
    {
      "kind": "tokenizer",
      "path": "tokenizer_config.json",
      "sha256": "4942d005604266809309cabc9f4e9cb89ce855d59b14681fdc0e1cc62ea26c4c",
      "size_bytes": 12487
    },
    {
      "kind": "tokenizer",
      "path": "vocab.json",
      "sha256": "ca10d7e9fb3ed18575dd1e277a2579c16d108e32f27439684afa0e10b1440910",
      "size_bytes": 2776833
    }
  ],
  "installed_size_bytes": 4703055333,
  "license_id": "Apache-2.0",
  "license_url": "https://huggingface.co/Qwen/Qwen3-ASR-1.7B",
  "manifest_version": 1,
  "model_id": "qwen3_asr_1_7b",
  "repository": "Qwen/Qwen3-ASR-1.7B",
  "requires_terms_acceptance": false,
  "revision": "7278e1e70fe206f11671096ffdd38061171dd6e5",
  "trust_remote_code": false,
  "worker": "qwen"
}
