{
  "environment": {
    "dtype": "float32",
    "python": "3.12",
    "runtime_backend": "fireredasr2s_torch",
    "worker_lock": "workers/firered/uv.lock",
    "worker_lock_sha256": "14543cb7df6705b7ec82ef75e4a265bf2edf9e7f8b4e9465560ac4114b26f445"
  },
  "estimated_download_bytes": 818896071,
  "files": [
    {
      "kind": "tokenizer",
      "path": "chinese-bert-wwm-ext_vocab.txt",
      "sha256": "45bbac6b341c319adc98a532532882e91a9cefc0329aa57bac9ae761c27b291c",
      "size_bytes": 109540
    },
    {
      "kind": "tokenizer",
      "path": "chinese-lert-base/added_tokens.json",
      "sha256": "44136fa355b3678a1146ad16f7e8649e94fb4fc21fe77e8310c060f61caaff8a",
      "size_bytes": 2
    },
    {
      "kind": "config",
      "path": "chinese-lert-base/config.json",
      "sha256": "6c367d7e3f531af958f650ccbb3267d4f0742e7aa798d948b539262a4d638b94",
      "size_bytes": 776
    },
    {
      "kind": "model",
      "path": "chinese-lert-base/pytorch_model.bin",
      "sha256": "b4ef03ee5a6ea58f973a2fe8fce42ba5d1cb006e5646c5cb32d421e9934c242d",
      "size_bytes": 411618486
    },
    {
      "kind": "tokenizer",
      "path": "chinese-lert-base/special_tokens_map.json",
      "sha256": "303df45a03609e4ead04bc3dc1536d0ab19b5358db685b6f3da123d05ec200e3",
      "size_bytes": 112
    },
    {
      "kind": "tokenizer",
      "path": "chinese-lert-base/tokenizer.json",
      "sha256": "53ff61207898738bbdc000f38abebef01041c8d23b6270c11855fc692d0a3ad6",
      "size_bytes": 268961
    },
    {
      "kind": "tokenizer",
      "path": "chinese-lert-base/tokenizer_config.json",
      "sha256": "61785aeaba176fba6d6489f27dccfd2ddee6aee2af0e590451cab7d8b57e0874",
      "size_bytes": 19
    },
    {
      "kind": "tokenizer",
      "path": "chinese-lert-base/vocab.txt",
      "sha256": "45bbac6b341c319adc98a532532882e91a9cefc0329aa57bac9ae761c27b291c",
      "size_bytes": 109540
    },
    {
      "kind": "config",
      "path": "config.yaml",
      "sha256": "e3b0c44298fc1c149afbf4c8996fb92427ae41e4649b934ca495991b7852b855",
      "size_bytes": 0
    },
    {
      "kind": "model",
      "path": "model.pth.tar",
      "sha256": "9a69e465132c79f639ba5a057cf06c90b2d7e36e4bbea56225ece260dcd0b0d4",
      "size_bytes": 406788602
    },
    {
      "kind": "tokenizer",
      "path": "out_dict",
      "sha256": "6f0f7e0004881d617bc6e1d7b5b39972da80dcb49576bca489b1603ee55e20bb",
      "size_bytes": 33
    }
  ],
  "installed_size_bytes": 818896071,
  "license_id": "Apache-2.0",
  "license_url": "https://huggingface.co/FireRedTeam/FireRedPunc",
  "manifest_version": 1,
  "model_id": "firered_punc",
  "repository": "FireRedTeam/FireRedPunc",
  "requires_terms_acceptance": false,
  "revision": "e448fd967f44182a1c323cc30f5d89f2400c28da",
  "trust_remote_code": false,
  "worker": "firered"
}
