{
  "environment": {
    "dtype": "bfloat16",
    "python": "3.12",
    "runtime_backend": "transformers",
    "worker_lock": "workers/granite/uv.lock",
    "worker_lock_sha256": "6851d5ef4d39956290e5207530db80e9390e68bf1ed1c5d17dcb80b37f4483af"
  },
  "estimated_download_bytes": 4636316501,
  "files": [
    {
      "kind": "tokenizer",
      "path": "added_tokens.json",
      "sha256": "b4956ad3505e979f2f25cc2e2be2163d8e23730f854b6c5a14ed106f3dd90549",
      "size_bytes": 26
    },
    {
      "kind": "tokenizer",
      "path": "chat_template.jinja",
      "sha256": "e3219da52634178f68696475ea4518ade9d1b5c9a71b825f28312b73afc432c0",
      "size_bytes": 193
    },
    {
      "kind": "config",
      "path": "config.json",
      "sha256": "cd1d45c8f93ea1b1c92efd5dbdeb134406cb28c8510a7c71d9b78a854d299691",
      "size_bytes": 2276
    },
    {
      "kind": "tokenizer",
      "path": "merges.txt",
      "sha256": "b6fe424e334903f7fb84d3a106d9730455f4744b9fe3c21ee136d97a00e72502",
      "size_bytes": 916646
    },
    {
      "kind": "model",
      "path": "model-00001-of-00003.safetensors",
      "sha256": "3c987fdc29940c49d2498ea5925e8d57f88661af3ef30f73e56e2434ded3e42f",
      "size_bytes": 2143518808
    },
    {
      "kind": "model",
      "path": "model-00002-of-00003.safetensors",
      "sha256": "8e18d6d3fbe009a95a4cf305e31c2aab4a3484eccbce29aa1aa1454fc8c046ee",
      "size_bytes": 2143963456
    },
    {
      "kind": "model",
      "path": "model-00003-of-00003.safetensors",
      "sha256": "32f823497bc179f6f346efdd46984ab60e44b3d443bf40a18d757ddce626a2d2",
      "size_bytes": 339045512
    },
    {
      "kind": "model",
      "path": "model.safetensors.index.json",
      "sha256": "dec67acdc06e74d87650a54a4b5fbb07bfcdb4ed9fd1b95edef8651f5d64599b",
      "size_bytes": 84396
    },
    {
      "kind": "config",
      "path": "preprocessor_config.json",
      "sha256": "382a6f26300937721969b01909c96c2e519620b6781f7b45cb8b2e348a932d87",
      "size_bytes": 336
    },
    {
      "kind": "config",
      "path": "processor_config.json",
      "sha256": "13edc723022827cc3620ba2e2b4bcf52287b365d77e60a31227f0a4b7dea5f9c",
      "size_bytes": 80
    },
    {
      "kind": "tokenizer",
      "path": "special_tokens_map.json",
      "sha256": "c08676c49fd7969a3130f72be6d4bf34da66aa484a6e21dffe359893a1bd5f2e",
      "size_bytes": 579
    },
    {
      "kind": "tokenizer",
      "path": "tokenizer.json",
      "sha256": "43ca88fd0519c64ef93fa0a90cbc4e560fe485b5ba60348a86bc3c624f37918e",
      "size_bytes": 7153607
    },
    {
      "kind": "tokenizer",
      "path": "tokenizer_config.json",
      "sha256": "de233c19cd9efa63738f7481f318fc2048060f751ac9fd7957b131c43226b403",
      "size_bytes": 17882
    },
    {
      "kind": "tokenizer",
      "path": "vocab.json",
      "sha256": "8af71076de8b0b626eed0f4c984faf0a7c062479164b2a31308a948524d4f69c",
      "size_bytes": 1612704
    }
  ],
  "installed_size_bytes": 4636316501,
  "license_id": "Apache-2.0",
  "license_url": "https://huggingface.co/ibm-granite/granite-speech-4.1-2b",
  "manifest_version": 1,
  "model_id": "granite_speech_4_1_2b",
  "repository": "ibm-granite/granite-speech-4.1-2b",
  "requires_terms_acceptance": false,
  "revision": "de575db64086f84fdc79da4932d1076e965bc546",
  "trust_remote_code": false,
  "worker": "granite"
}
