{
  "environment": {
    "dtype": "float32",
    "python": "3.12",
    "runtime_backend": "fireredasr2s_torch",
    "worker_lock": "workers/firered/uv.lock",
    "worker_lock_sha256": "14543cb7df6705b7ec82ef75e4a265bf2edf9e7f8b4e9465560ac4114b26f445"
  },
  "estimated_download_bytes": 4654184,
  "files": [
    {
      "kind": "config",
      "path": "Stream-VAD/cmvn.ark",
      "sha256": "c87f6f13edf0f0ec7535ddfc9cc3387d9268cb234b70182d566c5e2edf3ca473",
      "size_bytes": 1311
    },
    {
      "kind": "model",
      "path": "Stream-VAD/model.pth.tar",
      "sha256": "ec88a8ae8ac5f004cdbd20c1eac4a9e9d12067c3d51ac5b141afa1f921fb59c9",
      "size_bytes": 2283513
    },
    {
      "kind": "config",
      "path": "VAD/cmvn.ark",
      "sha256": "c87f6f13edf0f0ec7535ddfc9cc3387d9268cb234b70182d566c5e2edf3ca473",
      "size_bytes": 1311
    },
    {
      "kind": "model",
      "path": "VAD/model.pth.tar",
      "sha256": "63f4fb1b00a6b8607c118dd48efc18d5e40d67d99b7bf9aa7a8d61540cf23d71",
      "size_bytes": 2368049
    }
  ],
  "installed_size_bytes": 4654184,
  "license_id": "Apache-2.0",
  "license_url": "https://huggingface.co/FireRedTeam/FireRedVAD",
  "manifest_version": 1,
  "model_id": "firered_vad",
  "repository": "FireRedTeam/FireRedVAD",
  "requires_terms_acceptance": false,
  "revision": "7990aaccc6b7aec1e527743bd30201f2c4a03b8c",
  "trust_remote_code": false,
  "worker": "firered"
}
