{
  "environment": {
    "dtype": "bfloat16",
    "python": "3.12",
    "runtime_backend": "qwen_asr",
    "worker_lock": "workers/qwen/uv.lock",
    "worker_lock_sha256": "ef7d017bad97b5f521a4c137d7fec50bfc8dfdcc454a11a6699a111ba29809ce"
  },
  "estimated_download_bytes": 1840013484,
  "files": [
    {
      "kind": "tokenizer",
      "path": "chat_template.json",
      "sha256": "75a8cfca24f00de72d796fbfed6858fc9614ef3dabd8696684cc3bc03a9c58ff",
      "size_bytes": 1161
    },
    {
      "kind": "config",
      "path": "config.json",
      "sha256": "d616c65d46c4b90bdc651b0a0963ea932732241140f337f9bb6b0335a9c8ef09",
      "size_bytes": 5982
    },
    {
      "kind": "config",
      "path": "generation_config.json",
      "sha256": "948d089b23bca1d214e768d59c4438365665f52ec6d33678f4062206b3fbbb8c",
      "size_bytes": 115
    },
    {
      "kind": "tokenizer",
      "path": "merges.txt",
      "sha256": "8831e4f1a044471340f7c0a83d7bd71306a5b867e95fd870f74d0c5308a904d5",
      "size_bytes": 1671853
    },
    {
      "kind": "model",
      "path": "model.safetensors",
      "sha256": "47831d0e82f96b20e9034dba01a075ee06436654719f6a68289e49f1b65ce0e7",
      "size_bytes": 1835544544
    },
    {
      "kind": "config",
      "path": "preprocessor_config.json",
      "sha256": "45e120a4eda2c20c5d7f2ea9354e63536bf35e27aa573fb7cdf78017b378770d",
      "size_bytes": 330
    },
    {
      "kind": "tokenizer",
      "path": "tokenizer_config.json",
      "sha256": "3ab80063f8511deb9566e6ad438d17b7a6277fcffd52d92854112f19d36bd81c",
      "size_bytes": 12666
    },
    {
      "kind": "tokenizer",
      "path": "vocab.json",
      "sha256": "ca10d7e9fb3ed18575dd1e277a2579c16d108e32f27439684afa0e10b1440910",
      "size_bytes": 2776833
    }
  ],
  "installed_size_bytes": 1840013484,
  "license_id": "Apache-2.0",
  "license_url": "https://huggingface.co/Qwen/Qwen3-ForcedAligner-0.6B",
  "manifest_version": 1,
  "model_id": "qwen3_forced_aligner_0_6b",
  "repository": "Qwen/Qwen3-ForcedAligner-0.6B",
  "requires_terms_acceptance": false,
  "revision": "c7cbfc2048c462b0d63a45797104fc9db3ad62b7",
  "trust_remote_code": false,
  "worker": "qwen"
}
