{
  "environment": {
    "dtype": "bfloat16",
    "python": "3.12",
    "runtime_backend": "transformers_custom_code",
    "worker_lock": "workers/moss_td/uv.lock",
    "worker_lock_sha256": "cc71971228c3c3976622bd84fd273d6ab065c3873ea8800b06e79af137ef73a2"
  },
  "estimated_download_bytes": 1833089258,
  "files": [
    {
      "kind": "tokenizer",
      "path": "added_tokens.json",
      "sha256": "c0284b582e14987fbd3d5a2cb2bd139084371ed9acbae488829a1c900833c680",
      "size_bytes": 707
    },
    {
      "kind": "remote_code",
      "path": "chat_template.jinja",
      "sha256": "8641466a16b184ebaf7c4903391e607cfd532ab937e81a64120628ab79d827f4",
      "size_bytes": 4762
    },
    {
      "kind": "config",
      "path": "config.json",
      "sha256": "2b2b7a6e61334152bdd7ecf8a4da3073b4940a097e193d1d2b22093e77535234",
      "size_bytes": 2335
    },
    {
      "kind": "remote_code",
      "path": "configuration_moss_transcribe_diarize.py",
      "sha256": "b4d12b0f4609af69b61c2fe3aa5fbaf476af22278369e4540745bc47d1d37892",
      "size_bytes": 2663
    },
    {
      "kind": "config",
      "path": "generation_config.json",
      "sha256": "e53a4b3ce4f944230cf1ca8fed0c42f4ff0d8c1443eaf98b5315d987334dd9e4",
      "size_bytes": 107
    },
    {
      "kind": "tokenizer",
      "path": "merges.txt",
      "sha256": "8831e4f1a044471340f7c0a83d7bd71306a5b867e95fd870f74d0c5308a904d5",
      "size_bytes": 1671853
    },
    {
      "kind": "model",
      "path": "model-00000-of-00001.safetensors",
      "sha256": "9a0ceb4ab7330357db3ff583dba8d83625d5b733b00e1d55d6970e11b07026c4",
      "size_bytes": 1817113576
    },
    {
      "kind": "model",
      "path": "model.safetensors.index.json",
      "sha256": "0345ac5d8f360abe4e9adadb5fecd38e7730052b75f64bb58182818b1544cc36",
      "size_bytes": 65401
    },
    {
      "kind": "remote_code",
      "path": "modeling_moss_transcribe_diarize.py",
      "sha256": "a01da90fe1f7cb88942b8c56f443e7b4ecd307ed4b4c356ac08d7503dd7422c1",
      "size_bytes": 15101
    },
    {
      "kind": "config",
      "path": "preprocessor_config.json",
      "sha256": "ba2e601484abc80f4cded977f9a4fd4a53175b7d35c2f2511f0cfc3a32ad2499",
      "size_bytes": 315
    },
    {
      "kind": "remote_code",
      "path": "processing_moss_transcribe_diarize.py",
      "sha256": "6f228d22d9379e2f6a6830b18ce7336b22da8267547e96e65545d871d7f48766",
      "size_bytes": 10975
    },
    {
      "kind": "config",
      "path": "processor_config.json",
      "sha256": "a978c2dd54a65b576c3dae4b654fe9bcbac1184c6db2df0afb2c90fcdc872ae7",
      "size_bytes": 292
    },
    {
      "kind": "tokenizer",
      "path": "special_tokens_map.json",
      "sha256": "76862e765266b85aa9459767e33cbaf13970f327a0e88d1c65846c2ddd3a1ecd",
      "size_bytes": 613
    },
    {
      "kind": "tokenizer",
      "path": "tokenizer.json",
      "sha256": "bcf03774334462d6e34b5005cb11120a62275f146ee2953e68731ecdbce84fbb",
      "size_bytes": 11423222
    },
    {
      "kind": "tokenizer",
      "path": "tokenizer_config.json",
      "sha256": "61d04c96104177240688396655ae3f7cf38ce2ea036db867a1d2b6883e27c3d5",
      "size_bytes": 503
    },
    {
      "kind": "tokenizer",
      "path": "vocab.json",
      "sha256": "ca10d7e9fb3ed18575dd1e277a2579c16d108e32f27439684afa0e10b1440910",
      "size_bytes": 2776833
    }
  ],
  "installed_size_bytes": 1833089258,
  "license_id": "Apache-2.0",
  "license_url": "https://huggingface.co/OpenMOSS-Team/MOSS-Transcribe-Diarize",
  "manifest_version": 1,
  "model_id": "moss_td_0_9b",
  "repository": "OpenMOSS-Team/MOSS-Transcribe-Diarize",
  "requires_terms_acceptance": false,
  "revision": "704aa4a9c304e8520be88901e0d1960158ef5b15",
  "trust_remote_code": true,
  "worker": "moss_td"
}
